videoId,etag,publishedAt,title,description,channelTitle,categoryId,defaultAudioLanguage,duration,definition,caption,licensedContent,viewCount,likeCount,commentCount
FvQ8ieRAySY,u0boKldbkl1jfJnY-_aG3nOTeWA,2021-06-03T02:48:34Z,Love by Drowning Trailer,,Love By Drowning The Movie,1,en-US,PT1M37S,hd,false,False,523,,
uYPbbksJxIg,URhBtQDXtenu6_gTSWjatrEiKO4,2023-05-08T07:01:04Z,Oppenheimer | New Trailer,"Oppenheimer - In Theaters 7 21 23

Written and directed by Christopher Nolan, Oppenheimer is an IMAX®-shot epic thriller that thrusts audiences into the pulse-pounding paradox of the enigmatic man who must risk destroying the world in order to save it. 
 
The film stars Cillian Murphy as J. Robert Oppenheimer and Emily Blunt as his wife, biologist and botanist Katherine “Kitty” Oppenheimer. Oscar® winner Matt Damon portrays General Leslie Groves Jr., director of the Manhattan Project, and Robert Downey, Jr. plays Lewis Strauss, a founding commissioner of the U.S. Atomic Energy Commission. 
 
Academy Award® nominee Florence Pugh plays psychiatrist Jean Tatlock, Benny Safdie plays theoretical physicist Edward Teller, Michael Angarano plays Robert Serber and Josh Hartnett plays pioneering American nuclear scientist Ernest Lawrence.
 
Oppenheimer also stars Oscar® winner Rami Malek and reunites Nolan with eight-time Oscar® nominated actor, writer and filmmaker Kenneth Branagh. 
 
The cast includes Dane DeHaan (Valerian and the City of a Thousand Planets), Dylan Arnold (Halloween franchise), David Krumholtz (The Ballad of Buster Scruggs), Alden Ehrenreich (Solo: A Star Wars Story) and Matthew Modine (The Dark Knight Rises). 
 
The film is based on the Pulitzer Prize-winning book American Prometheus: The Triumph and Tragedy of J. Robert Oppenheimer by Kai Bird and the late Martin J. Sherwin. The film is produced by Emma Thomas, Atlas Entertainment’s Charles Roven and Christopher Nolan. 

Oppenheimer is filmed in a combination of IMAX® 65mm and 65mm large-format film photography including, for the first time ever, sections in IMAX® black and white analogue photography. 

Nolan’s films, including Tenet, Dunkirk, Interstellar, Inception and The Dark Knight trilogy, have earned more than $5 billion at the global box office and have been awarded 11 Oscars and 36 nominations, including two Best Picture nominations. 

Social Handles:
IG: https://www.instagram.com/oppenheimermovie    
TW: https://www.twitter.com/@oppenheimerfilm  
FB: https://www.facebook.com/OppenheimerMovie 
Reddit: https://www.reddit.com/user/OppenheimerMovie/
Twitch: https://www.twitch.tv/oppenheimermovie
Website: https://www.OppenheimerMovie.com   
#Oppenheimer",Universal Pictures,24,en,PT3M7S,hd,true,True,63305958,785377,31831
bRDuc3IdOn8,a7J5mB2rxEW8ibPla8b1bkfFY10,2020-02-26T15:06:52Z,The Painted Bird - Official Trailer I HD I IFC Films,"Opening April 17th in theaters

Directed by: Václav Marhoul
Starring: Stellan Skarsgård, Harvey Keitel, Barry Pepper, Julian Sands, Udo Kier & Jitka Cvancarová

Based on the acclaimed Jerzy Kosiriski novel, THE PAINTED BIRD is a meticulous 35mm black and white evocation of wild, primitive Eastern Europe at the bloody close of World War I. The film follows the journey of The Boy, entrusted by his persecuted parents to an elderly foster mother. The old woman soon dies and the Boy is on his own, wandering through the countryside, from village to village, farmhouse to farmhouse. As he struggles for survival, The Boy suffers through extraordinary brutality meted out by the ignorant, superstitious peasants and he witnesses the terrifying violence of the efficient, ruthless soldiers, both Russian and German. In a defining scene, one of the peasants shows The Boy the flight of a captive bird, whom the man has painted and then released back into its own flock. The bird is immediately ripped apart because it is different from its fellows. That lesson reinforces all The Boy already knows and will soon know better: difference is fatal. But there are rare moments of compassion: a German soldier spares The Boy, a priest intervenes on his behalf, and finally The Boy becomes the protégé of a Russian sniper, who is kind to the child, but ruthless with the enemy. And there are signs of love. The Boy is seduced by an older girl, finally re-discovering the comfort of intimacy, only to realize that he has been used. When he is miraculously reunited with his weakened father at the end of the war, The Boy is cold and impenetrable, hardened by his ordeal. Yet we can still glimpse something of the old, sensitive Boy behind the eyes of the new. Perhaps there is hope.

#IFCFilms #ThePaintedBird

Subscribe to IFC Films: https://bit.ly/2K4KMZV

Connect with IFC Online
IFC Films Official Site: http://www.ifcfilms.com
Follow IFC Films on Twitter: http://twitter.com/IFCFilms
Find IFC Films on Facebook: http://facebook.com/IFCFilmsOfficial
Follow IFC Films on Instagram : http://instagram.com/ifcfilms",IFC Films,1,en,PT2M38S,hd,false,True,730322,3195,412
AHmCH7iB_IM,fHJc2J9AVlkf_qbF0-BvsJMmpnk,2022-10-18T15:59:00Z,CREED III | Official Trailer,"There’s no enemy like the past. From director Michael B. Jordan, watch the official #Creed3 trailer now and see the movie in theaters and IMAX 3/3/23.

CREED III
Directed By: Michael B. Jordan
Screenplay By: Keenan Coogler and Zach Baylin
Story By: Ryan Coogler, Keenan Coogler, and Zach Baylin
Cast: Michael B. Jordan, Tessa Thompson, Jonathan Majors, Florian Munteanu

About MGM Studios: Metro-Goldwyn-Mayer Inc. is a leading entertainment company focused on the production and distribution of film and television content globally.  The company owns one of the world’s deepest libraries of premium film and television content.  In addition, MGM has investments in domestic and international television channels, including MGM-branded channels.

Connect with MGM Studios Online
Visit the MGM Studios WEBSITE: http://www.mgm.com/
Like MGM Studios on FACEBOOK: https://www.facebook.com/mgm/
Follow MGM Studios on TWITTER: https://twitter.com/MGM_Studios

CREED III | Official Trailer 
https://www.youtube.com/MGM",MGM,24,en-US,PT2M24S,hd,true,True,18332237,198362,11032
yP4puq7dgC4,D273oIbiEAcTnZo_0yoDT91gfFA,2019-11-14T17:17:08Z,Goldie (2019) | Official U.S. Trailer | Slick Woods | George Sample III | Danny Hoch,"Goldie (Slick Woods) is a star – well, not quite yet, but at least in the eyes of her little sisters Sherrie and Supreme she is. The rest of the world is bound to take note soon too. Her big break surely awaits, she’s just got to pick up that golden fur coat she’s had her eye on first. And land a role as a dancer in a hip-hop video. And keep child welfare services from separating her from Sherrie and Supreme after their mother is locked up. Holding onto those dreams isn’t easy when fate has placed such daunting obstacles in her path. With Goldie, Dutch director Sam de Jong has delivered a real New York film: raw and glamorous, unflinchingly realistic and relentlessly optimistic, with a ton of heart and at least as much attitude.

Director: Sam de Jong
Writers: Angel Gardner (story consultant), Sam de Jong
Stars: Slick Woods, George Sample III, Danny Hoch",Film Movement,1,,PT1M36S,hd,false,True,122923,407,33
cE0pvT1Lgrg,MjZt9C0oT5aXl9GMtFYSsqf4O30,2020-02-04T20:00:36Z,THE ROADS NOT TAKEN | Official Trailer | Bleecker Street,"WATCH NOW: https://www.watchtheroadsnottaken.com/

Watch the official trailer for The Roads Not Taken.  

--

Sally Potter’s THE ROADS NOT TAKEN follows a day in the life of Leo (Javier Bardem) and his daughter, Molly (Elle Fanning) as she grapples with the challenges of her father’s chaotic mind. As they weave their way through New York City, Leo’s journey takes on a hallucinatory quality as he floats through alternate lives he could have lived, leading Molly to wrestle with her own path as she considers her future.  Also starring Salma Hayek and Laura Linney.

--

Follow us on social for more:
Official Bleecker Street Site: https://bleeckerstreetmedia.com/
LIKE us on Facebook: https://www.facebook.com/BleeckerStFilms/
FOLLOW us on Twitter: https://twitter.com/bleeckerstfilms
FOLLOW us on Instagram: https://www.instagram.com/bleeckerstfilms/",Bleecker Street,1,en,PT1M59S,hd,false,False,696482,1394,100
M6E8gPmz7n4,lZq4taZ158RGB-hT8_itOqM59aM,2020-05-07T14:35:20Z,Babyteeth - Official Trailer I HD I IFC Films,"Available in theaters and VOD June 19.

When seriously ill teenager Milla falls madly in love with smalltime drug dealer Moses, it’s her parents’ worst nightmare. But as Milla’s first brush with love brings her a new lust for life, things get messy and traditional morals go out the window. Milla soon shows everyone in her orbit – her parents, Moses, a sensitive music teacher, a budding child violinist, and a disarmingly honest, pregnant neighbour – how to live like you have nothing to lose. What might have been a disaster for the Finlay family instead leads to letting go and finding grace in the glorious chaos of life. Babyteeth joyously explores how good it is not to be dead yet and how far we will go for love.

#IFCFilms #Babyteeth

Subscribe to IFC Films: https://bit.ly/2K4KMZV

Connect with IFC Online
IFC Films Official Site: http://www.ifcfilms.com
Follow IFC Films on Twitter: http://twitter.com/IFCFilms
Find IFC Films on Facebook: http://facebook.com/IFCFilmsOfficial
Follow IFC Films on Instagram : http://instagram.com/ifcfilms",IFC Films,1,en,PT2M14S,hd,false,True,575585,3969,205
J364vYbwpzo,_il7pTXqK1ZANI2HLG_ViV_Ls04,2020-10-22T14:10:17Z,Farewell Amor - Official Trailer | HD | IFC Films,"Opening in theaters and VOD December 11 

Director: Ekwa Msangi
Starring: Ntare Guma Mbaho Mwine, Zainab Jah, Jayme Lawson 

After 17 years in exile, Walter finally reunites with his family after being forced to leave Angola for New York City. We meet the family as Walter is picking up his wife, Esther, and daughter, Sylvia, from the airport to bring them home to his one-bedroom Brooklyn apartment. They quickly discover how the years of separation have turned them into absolute strangers. As they attempt to overcome the personal and political hurdles amongst them, they rely on the muscle memory of dance to find their way back “home.” FAREWELL AMOR is an immigrant story that has come to define the American landscape since its inception.

#FarewellAmor #IFCFilms 

Subscribe to IFC Films: https://bit.ly/2K4KMZV

Connect with IFC Online
IFC Films Official Site: http://www.ifcfilms.com
Follow IFC Films on Twitter: http://twitter.com/IFCFilms
Find IFC Films on Facebook: http://facebook.com/IFCFilmsOfficial
Follow IFC Films on Instagram : http://instagram.com/ifcfilms",IFC Films,1,en,PT2M7S,hd,false,True,68673,598,30
qSYt0Gtnzgs,xHe_CcWdPxGn6lt0WF-VbM1XD2o,2021-02-19T17:00:04Z,Last Call - Official Trailer | HD | IFC Films,"Opening in theaters and VOD March 19  

Director: Paolo Pilladi
Starring: Jeremy Piven, Taryn Manning, Bruce Dern

A local success story and real estate developer, Mick (Jeremy Piven), returns home to his offbeat blue collar Irish neighborhood in the shadows of Philadelphia for a funeral and is obligated to stay to ensure his parents’ ailing family business gets back on course. Amidst all of this, he grows closer to his childhood crush (Taryn Manning) who is also back in town, while enduring the constant ridicule from his old hometown crew. As Mick begins to reconnect with the neighborhood he grew up in, he finds himself at a crossroads when forced to either raze or resurrect the family bar.

#LastCall #IFCFilms 

Subscribe to IFC Films: https://bit.ly/2K4KMZV

Connect with IFC Online
IFC Films Official Site: http://www.ifcfilms.com
Follow IFC Films on Twitter: http://twitter.com/IFCFilms
Find IFC Films on Facebook: http://facebook.com/IFCFilmsOfficial
Follow IFC Films on Instagram : http://instagram.com/ifcfilms",IFC Films,24,en,PT2M44S,hd,false,True,79896,343,75
xwJ5IFxyc5c,9s0suNsvjTMo06SiljSDw8-qYZw,2020-12-08T17:20:24Z,Herself Official Trailer (2021) | Prime Video,"Single-mother Sandra (Clare Dunne) escapes her abusive partner with her two young children, only to find herself trapped in temporary accommodation. After months of struggling, she draws inspiration from one of her daughter’s bedtime stories and hits upon the idea of self-building an affordable home. She finds an architect who provides her with plans and is offered land by Peggy (Harriet Walter), a woman she cleans for. Aido (Conleth Hill), a building contractor, appears willing to help too. But as her past rears its head, in the form of Gary (Ian Lloyd Anderson), her possessive ex, and as bureaucrats fight back against her independent spirit, will Sandra be able to rebuild her life from the ground up?

» SUBSCRIBE: http://bit.ly/PrimeVideoSubscribe
  
About Prime Video:
Want to watch it now? We've got it. This week's newest movies, last night's TV shows, classic favorites, and more are available to stream instantly, plus all your videos are stored in Your Video Library. Over 150,000 movies and TV episodes, including thousands for Amazon Prime members at no additional cost.
 
Get More Prime Video: 
Stream Now: http://bit.ly/WatchMorePrimeVideo
Facebook: http://bit.ly/PrimeVideoFB
Twitter: http://bit.ly/PrimeVideoTW
Instagram: http://bit.ly/AmazonPrimeVideoIG
  
Prime Video
https://www.youtube.com/PrimeVideo",Prime Video,24,en,PT2M48S,hd,false,True,697514,1596,147
4gjvyfjeJKM,bBsd8moyort7oahYI7jZsF0_aLc,2020-03-05T16:35:07Z,The Other Lamb - Official Trailer I HD I IFC Midnight,"Opening in theaters and VOD April 3rd

Directed by: Malgorzata Szumowska
Starring: Michiel Huisman, Raffey Cassidy, Denise Gough, Kelly Campbell, Eve Connolly & Isabelle Connolly

For her entire life, the cult she was born into has been all that teenage Selah (Raffey Cassidy) has known. Along with a band of similarly cloistered young women she lives seemingly unstuck in time, cut off from modern society in a remote forest commune presided over by a man called Shepherd (Michiel Huisman), a controlling, messiah-like figure with a frightening dark side. But when her insular world is rocked by a series of nightmarish visions and disturbing revelations, Selah begins to question everything about her existence—including her allegiance to the increasingly dangerous Shepherd. Awash in images of primal, dreamlike dread, this provocative fable is a haunting vision of adolescent awakening and revolt.

#IFCFilms #IFCMidnight #TheOtherLamb

Subscribe to IFC Films: https://bit.ly/2K4KMZV

Connect with IFC Online
IFC Films Official Site: http://www.ifcfilms.com
Follow IFC Films on Twitter: http://twitter.com/IFCFilms
Find IFC Films on Facebook: http://facebook.com/IFCFilmsOfficial
Follow IFC Films on Instagram : http://instagram.com/ifcfilms",IFC Films,1,en,PT2M24S,hd,false,True,776210,3900,267
s_X35NgQTAk,sTWHwFn6XqcUN6kXwzqsYtNwLuU,2020-02-20T18:02:46Z,Human Capital | Official Trailer (HD) | Vertical Entertainment,"The lives of two families collide when their children begin a relationship that leads to a tragic accident and they must protect the ones they love.

Starring: Liev Schreiber, Marisa Tomei, Peter Sarsgaard, Maya Hawke, Alex Wolff
Directed By: Marc Meyers",Vertical,1,,PT2M26S,hd,false,True,223529,277,21
B48hwisZvEI,FyX-WWCoxCz3XdvfRotiYlT7ttc,2020-02-08T01:00:34Z,RESISTANCE - Official Trailer I HD I IFC Films,"Opening in theaters and VOD March 27th

Directed by: Jonathan Jakubowicz
Starring: Jesse Eisenberg, Ed Harris, Clémence Poésy, Matthias Schweighöfer, Félix Moati, Géza Rohrig, Karl Markovics, Vica Kerekes, Bella Ramsey & Edgar Ramírez

Before he was the world-famous mime Marcel Marceau, he was Marcel Mangel, an aspiring Jewish actor who joined the French Resistance to save the lives of thousands of children orphaned at the hands of the Nazis. Jesse Eisenberg stars in this compelling drama about a group of unsung heroes who put themselves in harm’s way to rise above hatred and oppression during World War II. As a young man growing up in Nazi-occupied Europe, Marcel has no intention of getting involved in the war – his pursuits include impersonating Charlie Chaplin in burlesque clubs, painting backdrops for his plays, and antagonizing his obstinate father. His life is thrown into upheaval when he is recruited into the French Resistance, putting his acting skills to the ultimate test in teaching orphaned Jewish children how to survive in the horrifying reality of the Holocaust. Based on the inspiring true story, RESISTANCE follows the revolutionary tale of a selfless act that would forever change countless lives.

#IFCFilms #Resistance

Subscribe to IFC Films: https://bit.ly/2K4KMZV

Connect with IFC Online
IFC Films Official Site: http://www.ifcfilms.com
Follow IFC Films on Twitter: http://twitter.com/IFCFilms
Find IFC Films on Facebook: http://facebook.com/IFCFilmsOfficial
Follow IFC Films on Instagram : http://instagram.com/ifcfilms",IFC Films,1,en,PT2M43S,hd,false,True,767390,2857,321
jhyQQb0A9y4,H66cDVKBbHWEh2xOhlVTCrBaI-Y,2020-02-04T16:00:17Z,LIE EXPOSED Trailer [HD] Mongrel Media,"Melanie experiences a terminal diagnosis, leading her to leave her husband and life behind for LA and an affair with a tintype photographer.

Distributed in Canada by Mongrel Media 
http://www.mongrelmedia.com
http://www.twitter.com/MongrelMedia 
http://www.facebook.com/MongrelMedia 
http://www.instagram.com/MongrelMedia",Mongrel Media,1,,PT2M11S,hd,false,False,14646,49,2
os2tIykAqNA,oRfycgQx4_A1Raw9EmVNzdUaEsI,2023-02-09T15:00:29Z,AIR - Official Trailer | Amazon Studios,"From award-winning director Ben Affleck, AIR reveals the unbelievable game-changing partnership between a then-rookie Michael Jordan and Nike’s fledgling basketball division which revolutionized the world of sports and contemporary culture with the Air Jordan brand. This moving story follows the career-defining gamble of an unconventional team with everything on the line, the uncompromising vision of a mother who knows the worth of her son’s immense talent, and the basketball phenom who would become the greatest of all time.

» SUBSCRIBE: http://bit.ly/AmazonStudiosSubscribe

Get More from Amazon Studios: 
Official site: http://bit.ly/GetMoreAmazonStudios
Facebook: http://bit.ly/AmazonStudiosFacebook
Twitter: http://bit.ly/AmazonStudiosTwitter
Instagram: http://bit.ly/AmazonStudiosInstagram

About Amazon Studios:
The goal of Amazon Studios is to turn original stories into great entertainment.

AIR - Official Trailer | Amazon Studios
https://youtu.be/os2tIykAqNA

Amazon Studios
https://www.youtube.com/AmazonStudios

#AIR #OfficialTrailer #AmazonStudios",Amazon Studios,1,en,PT2M17S,hd,true,False,137795,1464,114
8vmHFvnjPDw,69-4oime-i9R2izUDcQg44Yx7hw,2022-10-21T12:45:05Z,"Jesus Revolution (2023 Movie) Official Trailer - Kelsey Grammer, Joel Courtney","In Theaters Everywhere February 24, 2023, with early access screenings February 22, 2023. Starring Joel Courtney, Anna Grace Barlow, Jonathan Roumie, Kimberly Williams-Paisley and Kelsey Grammer.
  
Subscribe to the LIONSGATE: YouTube Channel for the latest movie trailers, clips, and more: https://bit.ly/2Z6nfym
 
#jesusrevolutionmovie
 
https://jesusrevolution.movie/
https://www.facebook.com/JesusRevolutionMovie/
https://twitter.com/jesusrevmovie
https://www.instagram.com/jesusrevolutionmovie/
https://www.tiktok.com/@lionsgate
 
In the 1970s, young Greg Laurie (Joel Courtney) is searching for all the right things in all the wrong places: until he meets Lonnie Frisbee (Jonathan Roumie), a charismatic hippie-street-preacher. Together with Pastor Chuck Smith (Kelsey Grammer), they open the doors of Smith’s languishing church to an unexpected revival of radical and newfound love, leading to what TIME Magazine dubbed a JESUS REVOLUTION.",Lionsgate Movies,1,en,PT2M6S,hd,true,True,32039474,42266,3832
-wh1DD0b7Wk,pcIGMLiCzYjXy4RpvUI9UBjgYyg,2020-03-10T17:04:06Z,The Artist's Wife - Official Trailer HD,"Claire (Lena Olin) lives a domestic life in the Hamptons as the wife of celebrated artist Richard Smythson (Bruce Dern). Once a promising painter herself, Claire now lives in the shadow of her husband’s illustrious career. While preparing work for his final show, Richard’s moods become increasingly erratic, and he is diagnosed with dementia. As his memory and behavior deteriorate, she shields his condition from the art community while trying to reconnect him with his estranged daughter and grandson from a previous marriage. Challenged by the loss of her world as she knew it, Claire must now decide whether to stand with Richard on the sidelines or step into the spotlight herself.

Coming Soon From Strand Releasing! https://strandreleasing.com/films/the-artists-wife/",Strand Releasing,1,,PT2M11S,hd,false,True,63653,231,12
U82heDabn5k,EIM9-tnAGRWv70m_4-nek9OLwiM,2020-10-28T15:00:02Z,Stardust – Official Trailer I HD I IFC Films,"Opening in theaters and VOD 25th

Director: Gabriel Range
Starring: Johnny Flynn, Jena Malone, Marc Maron

David Bowie is one of the most seminal legends in music history; but who was the man behind the many faces? In 1971, a 24-year-old fledgling David Bowie (Johnny Flynn) is sent to America to promote his newest record, The Man Who Sold the World. Leaving behind his pregnant wife Angie (Jena Malone), Bowie and his band embark on a makeshift coast-to-coast promotional tour with struggling Mercury Records publicist Rob Oberman (Marc Maron).

#Stardust #IFCFilms 

Subscribe to IFC Films: https://bit.ly/2K4KMZV

Connect with IFC Online
IFC Films Official Site: http://www.ifcfilms.com
Follow IFC Films on Twitter: http://twitter.com/IFCFilms
Find IFC Films on Facebook: http://facebook.com/IFCFilmsOfficial
Follow IFC Films on Instagram : http://instagram.com/ifcfilms",IFC Films,1,en,PT2M23S,hd,false,True,703072,3480,
6oHCzKqjnmw,CoaIOtTxXmNlQT30ALTvMXF0gDs,2021-10-22T11:50:58Z,Just One More Kiss (2020) | Official Trailer | Indican Pictures,"'Til death do us part' wasn't nearly long enough for Max and Abby as his ghost returns to help her get over him. But with a second chance to be together, neither will ever want to say goodbye again.

To watch more movie videos, subscribe to the Screendollars YouTube channel:
* https://bit.ly/3kqZVok
Don't forget to push the BELL icon so you'll never miss an update.

Stay connected with Screendollars on social media:
* Facebook: https://www.facebook.com/Screendollars-112268833968674/
* Twitter: https://twitter.com/screendollars
* Instagram: https://www.instagram.com/screendollars/
* Website: https://www.screendollars.com/

Distributor - Indican Pictures
Rating - %
Release Date - 2/21/2020
Cast - Patrick Zeller, Faleena Hopkins, Frances Mitchell, Erik Parillo
Director - Faleena Hopkins
Genres - Drama, Romance

Rent JUST ONE MORE KISS and other premium movies at THE MOVIE HUB:
* https://www.themoviehub.com/
Watch on-line and ad-free from your Smart TV or on your computer, phone or tablet.

#JustOneMoreKiss #JOMK #screendollars #themoviehub",Screendollars,22,,PT2M4S,hd,false,False,9,0,0
LoNoOn6c0gA,LFHYkzoI9RrG_TeT740FNsbMct4,2019-12-19T17:00:25Z,The Truth - Official Trailer I HD I IFC Films,"Available In Theaters and VOD July 3

Directed by: Hirokazu Koreeda
Starring: Catherine Deneuve, Juliette Binoche & Ethan Hawke

Legends of French cinema Catherine Deneuve and Juliette Binoche join masterful filmmaker Hirokazu Koreeda (Shoplifters, Still Walking) to paint a moving portrait of family dynamics in THE TRUTH. Fabienne (Catherine Deneuve) is an aging French movie star who, despite her momentary lapses in memory, remains a venerable force to be reckoned with. Upon the publication of her memoirs, her daughter Lumir (Juliette Binoche) returns to Paris from New York with her husband (Ethan Hawke) and their young daughter to commemorate its release. A sharp and funny battle of wits ensues between the mother-daughter duo, as Lumir takes issue with Fabienne's rose-colored version of the past. Reflected cleverly by Fabienne's latest role in a sci-fi drama, their strained relationship takes a poignant journey toward possible reconciliation. Charming, bold, and imbued with endless emotional insight, THE TRUTH offers a relatable look at human relationships, featuring exquisite performances from its all-star cast.

#IFCFilms #TheTruth

Subscribe to IFC Films: https://bit.ly/2K4KMZV

Connect with IFC Online
IFC Films Official Site: http://www.ifcfilms.com
Follow IFC Films on Twitter: http://twitter.com/IFCFilms
Find IFC Films on Facebook: http://facebook.com/IFCFilmsOfficial
Follow IFC Films on Instagram : http://instagram.com/ifcfilms",IFC Films,1,en,PT2M26S,hd,false,True,418705,2254,66
M8Lg78jgr4A,BZRGraFRh_9zWiVl7aBzSuT_Ks4,2020-07-14T23:05:17Z,Guest Artist Official Trailer (2020),,Indican Pictures,1,,PT1M35S,hd,false,False,190,2,3
e-UBeUuVf9E,l7UFphIi43UA1Tx4KzW6X8dgn4g,2019-05-13T20:00:08Z,YOU GO TO MY HEAD - TRAILER,,First Run Features,1,,PT2M40S,hd,false,False,8927,29,6
hjw_QTKr2rc,hYgCPHju_4XwIx5VxDdxwaVqG8I,2019-12-19T15:00:10Z,NEVER RARELY SOMETIMES ALWAYS - Official Trailer [HD] - At Home On Demand April 3,"An intimate portrayal of two teenage girls in rural Pennsylvania.  Faced with an unintended pregnancy and a lack of local support, Autumn and her cousin Skylar embark on a brave, fraught journey across state lines to New York City.

Directed by Eliza Hittman. Starring Sidney Flanigan, Talia Ryder, Théodore Pellerin, Ryan Eggold, and Sharon Van Etten. 

https://www.facebook.com/NeverRarelyFilm/
https://twitter.com/neverrarelyfilm
https://www.instagram.com/neverrarelyfilm/
http://neverrarelyfilm.com",Focus Features,24,,PT2M4S,hd,false,True,3316616,6676,1383
